{
  "schema_version": 1,
  "inventory_id": "synthetic-legacy-coverage",
  "source": {
    "kind": "SANITIZED_LOCAL_FIXTURE",
    "captured_at": "2026-07-15T00:00:00Z",
    "production_query_performed": false,
    "mutation_performed": false,
    "contains_secret_values": false
  },
  "objects": [
    {
      "id": "container:old-worker",
      "asset_type": "container",
      "lifecycle": "INACTIVE",
      "evidence_state": "COMPLETE",
      "dependencies": [],
      "owner": {"known": true, "in_use": false},
      "backup": {"required": true, "available": false, "verified": false},
      "dependency_evidence_complete": true,
      "rollback": {"required": false, "documented": false, "tested": false},
      "approval": {"required": true, "status": "NOT_REQUESTED"},
      "candidate_action": "ARCHIVE",
      "notes": ["Synthetic fixture only."]
    },
    {
      "id": "image:legacy-backend",
      "asset_type": "image",
      "lifecycle": "LEGACY",
      "evidence_state": "COMPLETE",
      "dependencies": [],
      "owner": {"known": true, "in_use": false},
      "backup": {"required": false, "available": false, "verified": false},
      "dependency_evidence_complete": true,
      "rollback": {"required": false, "documented": false, "tested": false},
      "approval": {"required": false, "status": "NOT_REQUIRED"},
      "candidate_action": "NONE",
      "notes": ["Dependency of the synthetic active service."]
    },
    {
      "id": "service:api",
      "asset_type": "service",
      "lifecycle": "ACTIVE",
      "evidence_state": "COMPLETE",
      "dependencies": ["image:legacy-backend"],
      "owner": {"known": true, "in_use": true},
      "backup": {"required": false, "available": false, "verified": false},
      "dependency_evidence_complete": true,
      "rollback": {"required": false, "documented": false, "tested": false},
      "approval": {"required": false, "status": "NOT_REQUIRED"},
      "candidate_action": "NONE",
      "notes": ["Synthetic active root."]
    },
    {
      "id": "frontend:v1",
      "asset_type": "frontend",
      "lifecycle": "LEGACY",
      "evidence_state": "COMPLETE",
      "dependencies": [],
      "owner": {"known": true, "in_use": false},
      "backup": {"required": true, "available": true, "verified": true},
      "dependency_evidence_complete": true,
      "rollback": {"required": false, "documented": false, "tested": false},
      "approval": {"required": true, "status": "APPROVED"},
      "candidate_action": "ARCHIVE",
      "notes": ["Synthetic archive-ready object."]
    },
    {
      "id": "feature_flag:dead-chat",
      "asset_type": "feature_flag",
      "lifecycle": "INACTIVE",
      "evidence_state": "COMPLETE",
      "dependencies": [],
      "owner": {"known": true, "in_use": false},
      "backup": {"required": false, "available": false, "verified": false},
      "dependency_evidence_complete": true,
      "rollback": {"required": false, "documented": false, "tested": false},
      "approval": {"required": true, "status": "PENDING"},
      "candidate_action": "DELETE",
      "notes": ["Classification permits deletion only after approval."]
    },
    {
      "id": "prompt_family:unused-v0",
      "asset_type": "prompt_family",
      "lifecycle": "LEGACY",
      "evidence_state": "COMPLETE",
      "dependencies": [],
      "owner": {"known": true, "in_use": false},
      "backup": {"required": true, "available": false, "verified": false},
      "dependency_evidence_complete": false,
      "rollback": {"required": false, "documented": false, "tested": false},
      "approval": {"required": true, "status": "NOT_REQUESTED"},
      "candidate_action": "DELETE",
      "notes": ["Synthetic incomplete cleanup gates."]
    },
    {
      "id": "qdrant_collection:unknown-old",
      "asset_type": "qdrant_collection",
      "lifecycle": "UNKNOWN",
      "evidence_state": "INCOMPLETE",
      "dependencies": [],
      "owner": {"known": false, "in_use": false},
      "backup": {"required": true, "available": false, "verified": false},
      "dependency_evidence_complete": false,
      "rollback": {"required": false, "documented": false, "tested": false},
      "approval": {"required": true, "status": "NOT_REQUESTED"},
      "candidate_action": "NONE",
      "notes": ["Must remain UNKNOWN."]
    },
    {
      "id": "volume:unused-cache",
      "asset_type": "volume",
      "lifecycle": "INACTIVE",
      "evidence_state": "COMPLETE",
      "dependencies": [],
      "owner": {"known": true, "in_use": false},
      "backup": {"required": true, "available": false, "verified": false},
      "dependency_evidence_complete": true,
      "rollback": {"required": false, "documented": false, "tested": false},
      "approval": {"required": true, "status": "NOT_REQUESTED"},
      "candidate_action": "ARCHIVE",
      "notes": ["Synthetic orphan."]
    },
    {
      "id": "pm2_process:old-ui",
      "asset_type": "pm2_process",
      "lifecycle": "INACTIVE",
      "evidence_state": "COMPLETE",
      "dependencies": [],
      "owner": {"known": true, "in_use": false},
      "backup": {"required": false, "available": false, "verified": false},
      "dependency_evidence_complete": true,
      "rollback": {"required": false, "documented": false, "tested": false},
      "approval": {"required": true, "status": "NOT_REQUESTED"},
      "candidate_action": "NONE",
      "notes": ["Synthetic stopped process."]
    },
    {
      "id": "network_workload:metrics",
      "asset_type": "network_workload",
      "lifecycle": "ACTIVE",
      "evidence_state": "COMPLETE",
      "dependencies": ["configuration:legacy-metrics"],
      "owner": {"known": true, "in_use": true},
      "backup": {"required": false, "available": false, "verified": false},
      "dependency_evidence_complete": true,
      "rollback": {"required": false, "documented": false, "tested": false},
      "approval": {"required": false, "status": "NOT_REQUIRED"},
      "candidate_action": "NONE",
      "notes": ["Synthetic foreign workload classification input."]
    },
    {
      "id": "configuration:legacy-metrics",
      "asset_type": "configuration",
      "lifecycle": "LEGACY",
      "evidence_state": "COMPLETE",
      "dependencies": [],
      "owner": {"known": true, "in_use": false},
      "backup": {"required": false, "available": false, "verified": false},
      "dependency_evidence_complete": true,
      "rollback": {"required": false, "documented": false, "tested": false},
      "approval": {"required": false, "status": "NOT_REQUIRED"},
      "candidate_action": "NONE",
      "notes": ["Synthetic active dependency."]
    },
    {
      "id": "backup:rollback-v1",
      "asset_type": "backup",
      "lifecycle": "INACTIVE",
      "evidence_state": "COMPLETE",
      "dependencies": [],
      "owner": {"known": true, "in_use": false},
      "backup": {"required": false, "available": true, "verified": true},
      "dependency_evidence_complete": true,
      "rollback": {"required": true, "documented": true, "tested": true},
      "approval": {"required": false, "status": "NOT_REQUIRED"},
      "candidate_action": "NONE",
      "notes": ["Synthetic rollback root."]
    },
    {
      "id": "port:unused-9001",
      "asset_type": "port",
      "lifecycle": "INACTIVE",
      "evidence_state": "COMPLETE",
      "dependencies": [],
      "owner": {"known": true, "in_use": false},
      "backup": {"required": false, "available": false, "verified": false},
      "dependency_evidence_complete": false,
      "rollback": {"required": false, "documented": false, "tested": false},
      "approval": {"required": true, "status": "NOT_REQUESTED"},
      "candidate_action": "DELETE",
      "notes": ["Synthetic unproven port cleanup."]
    }
  ]
}
